{
  "$schema": "https://dotnet-modulith-baseline.local/schemas/adopt-spec.v1.schema.json",
  "schemaVersion": "1.0",
  "projectName": "Acme Platform",
  "projectSlug": "acme-platform",
  "solutionFileName": "acme-platform.sln",
  "modulePreset": "recommended-first-product-base",
  "scratch": {
    "mode": "repo-local",
    "root": ".tmp"
  },
  "database": {
    "resetLocalDatabase": false
  },
  "validation": {
    "profile": "full"
  }
}
